{
  "schema_id": "SNE-F01-AUTHORIZATION-v1",
  "work_order_id": "SNE-WO-F01",
  "authorization_id": null,
  "request_state": "PROPOSED",
  "category": null,
  "scope": {
    "task_id": null,
    "purpose": null,
    "actor_private_id": null,
    "device_private_id": null,
    "planning_repository_commit": "148dc28cdbdf4970c8011d76762b31b8dcafea0b",
    "source_revisions": [],
    "allowed_read_paths": [],
    "allowed_write_paths": [],
    "allowed_operations": [],
    "forbidden_operations": [
      "source-game edits",
      "unapproved installs",
      "unapproved network",
      "private Mantle data",
      "public IWAD redistribution",
      "GitHub mutation"
    ],
    "network_access_allowed": false,
    "dependency_downloads_allowed": false,
    "licensed_external_resource_private_refs": [],
    "private_raw_evidence_root": null,
    "public_redacted_summary_path": null,
    "max_duration_minutes": null,
    "max_output_bytes": null,
    "retention_policy": null,
    "stop_conditions": [],
    "rollback_plan": null
  },
  "scope_sha256": null,
  "scope_digest_method": "SHA256(sorted-key compact UTF-8 JSON of scope object; digest and signature excluded)",
  "operator_signature_private_ref": null,
  "operator_approved_at": null,
  "valid_from": null,
  "expires_at": null,
  "independent_reviewer_private_id": null,
  "revoked": false,
  "revocation_id": null,
  "operator_authentication_verified_by_executor": false,
  "dispatch_admission": "BLOCKED",
  "execution_attempted": false,
  "execution_status": "NOT RUN",
  "notes": "UNSIGNED TEMPLATE — presence in Git or APPROVED text is not authenticated consent."
}
